<?xml version="1.0" encoding="UTF-8" ?>
<!DOCTYPE starmx PUBLIC "-//STAR Lab//StarMX Configuration DTD 1.0//EN" "starmx-1.0.dtd" >
<starmx>

	<mbeanserver id="ms" lookup-type="platform" />
<!--     
	<mbeanserver id="ms" lookup-type="jmx" >
		<jmx-param service-url="service:jmx:rmi://localhost/jndi/rmi://localhost:1090/jmxconnector" />
	</mbeanserver>
-->
	<mbean id="mbean11" object-name="starmx:name=mb1,instance=1" mbeanserver="ms" />
	<mbean id="mbean12" object-name="starmx:name=mb1,instance=2" mbeanserver="ms" />
	<mbean id="mbean1" object-name="starmx:name=mb1,*" mbeanserver="ms" />

	<mbean id="mbean2" object-name="starmx:name=mb2" mbeanserver="ms" />

	<execute>
		<timer-info interval="3" unit="second" />
		<process id="policy1" policy-type="spl" policy-file="Policy1.spl">
			<object name="mb1_1" ref="mbean11" />
		</process>
	</execute>
<!--  
	<policy name="policy2">
		<splfile>Policy2.spl</splfile>

		<object name="mb1_1" ref="mbean11" />

		<evaluate mechanism="timer" >
			<timer-info interval="10" unit="second"/> 
		</evaluate>
	</policy>

	<policy name="policy3">
		<splfile>Policy3.spl</splfile>

		<object name="mb1_2" ref="mbean12" />

		<evaluate mechanism="timer" >
			<timer-info interval="5" unit="second"/> 
		</evaluate>
	</policy>
  
	<policy name="policy4">
		<splfile>Policy4.spl</splfile>

		<object name="mb2" type="mbean" ref="mbean2" />
		
		<evaluate mechanism="notification" >
			<notification-info event-type="starmx.test.event1" 
								emitter-mbean="mbean1" 
								event-handling="asynch"	/>			
		</evaluate>
	</policy>
	 -->
<!-- 
	<policy name="policy5">
		<splfile>Policy4.spl</splfile>

		<object name="mb2" type="mbean" ref="mbean2" />
		
		<evaluate mechanism="timer" >
			<timer-info interval="5" unit="second"/> 
		</evaluate>
	</policy>
-->
	<property name="starmx.mbean.history_size">10</property>
	<property name="starmx.mbean.add_to_history_strategy">anyRead/firstReadInPolicyExecution(default)</property>
	<property name="starmx.mbean.cache_attr_in_policy_execution">true/false</property>
	<property name="starmx.mbean.convert_objectname_to_mbean">true(default)/false</property>
</starmx>
